ACCOM_NAME,IMG_PATH,TOTAL_REVIEWS
TOC 호스텔 바르셀로나 (TOC Hostel Barcelona),https://pix8.agoda.net/hotelImages/785/785641/785641_15072118290032724298.jpg?ca=4&ce=1&s=1024x768,6449
호텔 바르셀로나 아에로푸에르토 바이 멜리아 (Hotel Barcelona Aeropuerto By Melia),https://pix8.agoda.net/hotelImages/2418/-1/7aaa1b0e0c0b69ef91058134c0f01ab4.jpg?ca=16&ce=1&s=1024x768,10589
호스텔 세인트 크리스토퍼스 바르셀로나 (Hostel St Christophers Barcelona),https://pix8.agoda.net/hotelImages/407699/-1/0bc9d9925b7e2e0c64aeaaf05c861da2.jpg?ca=9&ce=1&s=1024x768,1831
엑스포 바르셀로나 호텔 (Expo Barcelona Hotel),https://pix8.agoda.net/hotelImages/112/11286/11286_15010714290024334990.jpg?ca=3&ce=1&s=1024x768,1326
InterContinental Barcelona,https://pix8.agoda.net/hotelImages/7172860/0/0593ffcc2c3d26b577cae811eae3928d.jpg?ca=23&ce=0&s=1024x768,3253
호텔 암빗 바르셀로나 (Hotel Ambit Barcelona),https://pix8.agoda.net/hotelImages/936/936528/936528_15071020580032080692.jpg?ca=4&ce=1&s=1024x768,1175
"Radisson Blu 1882 Hotel, Barcelona Sagrada Familia",https://pix8.agoda.net/hotelImages/4848400/-1/7c6f772544c04b58ce9e72bbced9214b.jpg?ca=7&ce=1&s=1024x768,10122
The Central House Barcelona Gracia,https://pix8.agoda.net/hotelImages/544802/-1/77e08e962b7317aca1bd8f2dbe6c16b0.jpg?ca=9&ce=1&s=1024x768,4762
호텔 바르셀로나 하우스 (Hotel Barcelona House),https://pix8.agoda.net/hotelImages/181/181083/181083_14041622100019102614.jpg?ca=2&ce=1&s=1024x768,1263
카사 캄페르 바르셀로나 (Casa Camper Barcelona),https://pix8.agoda.net/hotelImages/6758895/530225691/0f8f76d3dc54a638528d6c6bbb2273d7.jpg?ce=0&s=1024x768,1324
톡 호스텔 마드리드 (TOC Hostel Madrid),https://pix8.agoda.net/hotelImages/833/833038/833038_16072020090044806120.png?ca=6&ce=1&s=1024x768,7910
The Madrid Edition,https://pix8.agoda.net/hotelImages/32612115/0/75d65e01802d5ca560b53a088a1de590.jpg?ce=0&s=1024x768,425
파 홈 아토차 (Far Home Atocha),https://pix8.agoda.net/hotelImages/1061876/-1/c39719d464118478c7ba0c12a82fc0f4.png?ca=7&ce=1&s=1024x768,1760
더 햇 호스텔 마드리드 (The Hat Hostel Madrid),https://pix8.agoda.net/hotelImages/569/569355/569355_16110419370048451879.jpg?ca=6&ce=1&s=1024x768,691
멜리아 마드리드 세라노 (Melia Madrid Serrano),https://pix8.agoda.net/hotelImages/4009/0/1c9f0fa20db792901a2157bd1092392c.jpg?ca=0&ce=1&s=1024x768,77
호텔 콰트로 푸에르타 델 솔 (Hotel Quatro Puerta del Sol),https://pix8.agoda.net/hotelImages/4865726/0/568e3f74cccd635804fbd8eb58e05977.jpeg?ce=0&s=1024x768,4884
Radisson RED Madrid,https://pix8.agoda.net/hotelImages/18874500/0/0a973a4ddc52d8c1eb64c7c881bd33f9.jpg?ce=0&s=1024x768,8974
B&B 호텔 마드리드 센트로 푸에르타 델 솔 (B&B Hotel Madrid Centro Puerta del Sol),https://q-xx.bstatic.com/xdata/images/hotel/max1024x768/84574753.jpg?k=b5ac5138581584a00260a4c4cd2c0b70e677d12ceab8a2da297362d5c1667ae4&o=,6796
호텔 리아베니 (Hotel Liabeny),https://pix8.agoda.net/hotelImages/4860788/0/5728a1b65a1156171d4f26462f4b1f89.jpg?ca=9&ce=1&s=1024x768,17757
easyHotel Madrid Centro Atocha,https://pix8.agoda.net/hotelImages/32844178/-1/f23f8fc8f108087bc536d1169a481862.jpg?ce=0&s=1024x768,6538
톡 호스텔 세비야 (Toc Hostel Sevilla),https://pix8.agoda.net/hotelImages/10256764/-1/6c48c9211b318ff6deddf666e1159886.jpg?ca=27&ce=0&s=1024x768,1841
Hotel Giralda Center,https://q-xx.bstatic.com/xdata/images/hotel/max1024x768/480171637.jpg?k=f1a9cccbff1d346951a6432346c03119f1d5e11d9b851691142d81f4d92ba7d2&o=,4684
Ibis Styles Sevilla Santa Justa,https://pix8.agoda.net/hotelImages/30577462/-1/70e7e4a50deb09c98cad74af0ead4dc5.jpg?ca=27&ce=0&s=1024x768,3785
블랙 스완 호스텔 세비야 (Black Swan Hostel Sevilla),https://pix8.agoda.net/hotelImages/438/4387270/4387270_18013019500061409111.jpg?ca=6&ce=1&s=1024x768,453
"Radisson Collection Hotel, Magdalena Plaza Sevilla",https://pix8.agoda.net/hotelImages/22338335/0/e43d0a0688d02e6a945d42f055f9dbdb.jpg?ca=20&ce=0&s=1024x768,2834
Petit Palace Vargas,https://pix8.agoda.net/hotelImages/45899092/-1/6631f4f474ae80b653fa232dc78bed6b.jpg?ce=0&s=1024x768,9007
room007 Salvador Hostel,https://q-xx.bstatic.com/xdata/images/hotel/max1024x768/429552637.jpg?k=60114ebad9840d515deeac0010714e0e8afc3c96fbbbe1523799d34f33405963&o=,6236
호텔 레이 알폰소 엑스 (Hotel Rey Alfonso X),https://pix8.agoda.net/hotelImages/701/70160/70160_14060219330019671281.jpg?ca=2&ce=1&s=1024x768,11144
room007 Select Tetuán (room007 Select Tetuan),https://q-xx.bstatic.com/xdata/images/hotel/max1024x768/429502545.jpg?k=a56678011fe231b97f11751ee55655dceef79a377b38a41b0efff15539fbf677&o=,5682
포 유 호스텔 세비야 (For You Hostel Sevilla),https://q-xx.bstatic.com/xdata/images/hotel/max1024x768/493490550.jpg?k=0fe47529b9b469e56e35165900e9e0c747d3f079bbddfe1077e58b14bf537410&o=,3767
Art&Flats Hostel,https://q-xx.bstatic.com/xdata/images/hotel/max1024x768/277993021.jpg?k=e444c82d86eba3eda407b8feb5c1a918bee8bde6d3c421cccddc56a3ac1c871e&o=,54
세나토르 파르케 센트럴 호텔 (Senator Parque Central Hotel),https://pix8.agoda.net/hotelImages/251/251075/251075_1112170648005200238.jpg?ca=0&ce=1&s=1024x768,449
호텔 유로스타 레이 돈 하이메 (Hotel Eurostars Rey Don Jaime),https://pix8.agoda.net/hotelImages/5077125/0/1156cbf425631cf9a203c806bcd332c1.jpg?ca=23&ce=0&s=1024x768,401
더 리버 호스텔 (The River Hostel),https://pix8.agoda.net/hotelImages/452/452915/452915_13051205390012226852.jpg?ca=0&ce=1&s=1024x768,54
캐주얼 발렌시아 데 라스 아르테스 (Casual Valencia De Las Artes),https://pix8.agoda.net/hotelImages/467/467767/467767_14082601070021566600.jpg?ca=2&ce=1&s=1024x768,4000
Casual Vintage Valencia,,0
몬 스위트 카테드랄 (Mon Suites Catedral),,0
유로스타 악테온 (Eurostars Acteon),https://pix8.agoda.net/hotelImages/34294857/0/645a386f7150ffe39eca76a15cbccf3c.jpg?ce=0&s=1024x768,11951
Mon Suites Benlliure,,0
AC 호텔 발렌시아 (AC Hotel Valencia),https://pix8.agoda.net/hotelImages/7904/0/dc995f33b4f0d7fb762d0a0116552c8d.jpg?ca=7&ce=1&s=1024x768,17
