ACCOM_NAME,IMG_PATH,TOTAL_REVIEWS
뷰 시드니 (View Sydney),https://pix8.agoda.net/hotelImages/42802/-1/7a6900b33f14fd699aca8552e33ce585.jpg?ce=0&s=1024x768,12509
"포 포인츠 바이 쉐라톤 시드니, 센트럴 파크 (Four Points by Sheraton Sydney, Central Park)",https://pix8.agoda.net/hotelImages/6535323/0/885944253549c977cb135cd8f4266497.jpg?ce=0&s=1024x768,1643
리틀 내셔널 호텔 시드니 (Little National Hotel Sydney),https://pix8.agoda.net/hotelImages/16403544/-1/ebf42f10b7e63c9c8d588ab145b62c9a.jpg?ca=15&ce=1&s=1024x768,9709
Kith Hotel Darling Harbour,https://pix8.agoda.net/hotelImages/134/13429503/13429503_20030520060088950216.jpg?ca=10&ce=1&s=1024x768,514
Ace Hotel Sydney,https://pix8.agoda.net/hotelImages/34390657/0/099b2e7dc4a9a9b41d46a48ea7a6ff84.jpg?ce=0&s=1024x768,1366
YHA Sydney Harbour,https://pix8.agoda.net/hotelImages/396/396356/396356_15071611550032427306.jpg?ca=4&ce=1&s=1024x768,7980
Radisson Blu Plaza Hotel Sydney,https://pix8.agoda.net/hotelImages/37236103/-1/f13088a701d87b5fe07fdbae100e93a5.png?ce=0&s=1024x768,6130
더 시드니 블러바드 호텔 (The Sydney Boulevard Hotel),https://pix8.agoda.net/hotelImages/1125/-1/5a0d9a5ed589e663d178d8bb50c77a7d.jpg?ca=7&ce=1&s=1024x768,6245
아모라 제이미슨 호텔  (Amora Jamison Hotel),https://pix8.agoda.net/hotelImages/27825415/0/79e29200a0569f67a220fb8de98156fc.jpg?ca=21&ce=0&s=1024x768,2984
YEHS 호텔 시드니 QVB (YEHS Hotel Sydney QVB),https://pix8.agoda.net/hotelImages/5902712/-1/ed8292396278800cc47dd49e820ee797.jpg?ca=8&ce=1&s=1024x768,2009
Dorsett Melbourne,https://pix8.agoda.net/hotelImages/39567164/-1/62fa40e3c6d98a7b33105a169d33c8fe.jpg?ce=0&s=1024x768,4436
Voco Melbourne Central,https://pix8.agoda.net/hotelImages/21979575/0/1c8327ce7bfa476252e0fbc82acee948.jpg?ce=0&s=1024x768,276
브래디 호텔 존스 레인 (Brady Hotels Jones Lane),https://pix8.agoda.net/hotelImages/6881073/-1/2d444f13dba8042bfb2df7a3037e0f3c.jpg?ca=13&ce=1&s=1024x768,3457
랑데부 호텔 멜번 (Rendezvous Hotel Melbourne),https://pix8.agoda.net/hotelImages/7914/-1/16a7fce00e27e9035aee72d8872e441f.jpg?ca=23&ce=0&s=1024x768,13308
인터컨티넨탈 멜버른 더 리알토 (InterContinental Melbourne The Rialto),https://pix8.agoda.net/hotelImages/5260151/0/ceb54ebe4373ac987e6fbcaa5d5d7a2b.jpeg?ce=0&s=1024x768,670
브래디 호텔 센트럴 멜번 (Brady Hotels Central Melbourne),https://pix8.agoda.net/hotelImages/4880782/0/1d3daaf7da6d926773789b2bcc730c9b.jpg?ca=28&ce=0&s=1024x768,2394
Radisson On Flagstaff Gardens,https://pix8.agoda.net/hotelImages/9455095/0/01113098928ecdbbe294a2299818ecbc.jpg?ca=9&ce=1&s=1024x768,6759
이비스 멜버른 센트럴 (ibis Melbourne Central),https://pix8.agoda.net/hotelImages/6889546/93437995/8410bb9654628ae9b0d0a4dc55597f0f.jpg?ca=10&ce=1&s=1024x768,1222
시티 엣지 온 엘리자베스 아파트먼트 호텔 (City Edge on Elizabeth Apartment Hotel),https://pix8.agoda.net/hotelImages/245/245873/245873_15011810150024667268.jpg?ca=3&ce=1&s=1024x768,1051
Sakura Serviced Apartment,https://pix8.agoda.net/hotelImages/571/5714667/5714667_18082113200067569209.jpg?ca=0&ce=1&s=1024x768,315
하얏트 리젠시 브리즈번 (Hyatt Regency Brisbane),https://pix8.agoda.net/hotelImages/666044/-1/810c22e7e2dbf1308363c517a46f89d3.png?ca=17&ce=1&s=1024x768,1204
Indigo Brisbane City Centre,https://pix8.agoda.net/hotelImages/32612594/0/87fce1b3fed8f9ef0890b7a4851bbc51.jpg?ce=0&s=1024x768,2460
오크스 브리즈번 온 샬럿 스위트 (Oaks Brisbane on Charlotte Suites),https://pix8.agoda.net/hotelImages/147891/-1/7af3b030c04f04b78bbf007b5801ef60.jpg?ca=10&ce=1&s=1024x768,11101
소호 브리즈번 호텔 (Soho Brisbane Hotel),https://pix8.agoda.net/hotelImages/336745/-1/7da0f30726e69f04b82c38a9d1bca389.jpg?ca=0&ce=1&s=1024x768,3140
힐튼 브리즈번 (Hilton Brisbane),https://pix8.agoda.net/hotelImages/2290733/0/1557583e1650c926f68f61913b7d1f72.jpg?ca=9&ce=1&s=1024x768,807
메리톤 스위트 허쉘 스트리트 (Meriton Suites Herschel Street),https://pix8.agoda.net/hotelImages/8707173/-1/249e4814a1512ccaedf53b62ac6a347c.jpg?ce=0&s=1024x768,526
홀리데이 인 익스프레스 브리즈번 센트럴 (Holiday Inn Express Brisbane Central),https://pix8.agoda.net/hotelImages/158/1589721/1589721_17082415040055684645.jpg?ca=6&ce=1&s=1024x768,818
이비스 스타일 브리즈번 엘리자베스 스트리트 (Ibis Styles Brisbane Elizabeth Street),https://pix8.agoda.net/hotelImages/1161079/-1/f9f7645a855cb3bd4810c0669f6ee3fe.jpg?ca=10&ce=1&s=1024x768,1279
Selina Brisbane,https://pix8.agoda.net/hotelImages/38049184/0/8a4f73719d893ab9a20e1f5525404c62.jpg?ce=0&s=1024x768,203
Voco Brisbane City Centre,https://pix8.agoda.net/hotelImages/30161770/0/402d868ba9078a72cb972234d397d203.jpg?ce=0&s=1024x768,1748
크리스탈브룩 라일리 (Crystalbrook Riley),https://pix8.agoda.net/hotelImages/7457335/0/8305557b68b18c78cd200e90984183a3.jpg?ca=23&ce=0&s=1024x768,439
오크스 케언즈 호텔 (Oaks Cairns Hotel),https://pix8.agoda.net/hotelImages/14439261/-1/80f976091573806ef2bb3ee4c124a244.jpg?ca=15&ce=1&s=1024x768,209
플린 어 크리스탈브룩 컬렉션 호텔 (Crystalbrook Flynn),https://pix8.agoda.net/hotelImages/124/12433720/12433720_20020407380087759728.jpg?ca=10&ce=1&s=1024x768,3067
레이크 센트럴 케언즈 (Lake Central Cairns),https://pix8.agoda.net/hotelImages/493/4936793/4936793_19090411290080451407.jpg?ca=13&ce=1&s=1024x768,151
더블트리 바이 힐튼 케언즈 (DoubleTree by Hilton Cairns),https://pix8.agoda.net/hotelImages/2290658/0/43a35233c875732c3f47c378f5ca0f2a.jpg?ce=0&s=1024x768,862
힐튼 케언즈 (Hilton Cairns),https://pix8.agoda.net/hotelImages/3284/-1/4735c885d37244cf374867296ca47325.jpg?ca=27&ce=0&s=1024x768,844
선샤인 타워 호텔 (Sunshine Tower Hotel),https://pix8.agoda.net/hotelImages/77462/-1/447b8fd009fd056f2a8ff14227963e97.jpg?ca=6&ce=1&s=1024x768,4978
베일리 어 크리스탈브룩 컬렉션 호텔 앤 레지던스 (Crystalbrook Bailey),https://pix8.agoda.net/hotelImages/8523858/-1/b8d16d2fb7c73d0bb85f1bc6c58194bb.jpg?ca=10&ce=1&s=1024x768,254
코럴 트리 인 호텔 (Coral Tree Inn Hotel),https://pix8.agoda.net/hotelImages/11681/-1/a8d900161ff5564e2ec2661d46c322ee.png?ce=0&s=1024x768,6341
The Abbott - Boutique Hotel,https://q-xx.bstatic.com/xdata/images/hotel/max1024x768/278471745.jpg?k=baa9280d1d53419c904fe54e75ebd1a4a127d1d6c41865cdfe4630e4af2571d1&o=,24
